A1: 2011-08-05
A2: sensor P01
A3: Vs | B3: 5.127
A4: Vo | B4: 2.586
A5: coef | B5: 10.84 | C5: -28.02
A6: P = 10.84 Vout - 28.02
A9: 2011-08-05
A10: sensor P02
A11: Vs | B11: 5.115
A12: Vo | B12: 2.58
A13: coef | B13: 10.86 | C13: -28.02
A14: P = 10.86 Vout - 28.02
A17: 2011-08-05
A18: sensor P03
A19: Vs | B19: 5.109
A20: Vo | B20: 2.562
A21: coef | B21: 10.87 | C21: -27.86
A22: P = 10.87Vout - 27.86
A25: 2011-08-05
A26: sensor P04
A27: Vs | B27: 5.111
A28: Vo | B28: 2.574
A29: coef | B29: 10.87 | C29: -27.98
A30: P = 10.87 Vout - 27.98
A32: 2011-08-24
A33: sensor P05
A34: Vs | B34: 5.124
A35: Vo | B35: 2.572
A36: coef | B36: 10.84 | C36: -27.89
A37: P = 10.84 Vout - 27.89
A39: 2011-08-24
A40: sensor P06
A41: Vs | B41: 5.141
A42: Vo | B42: 2.591
A43: coef | B43: 10.81 | C43: -28.00
A44: P = 10.81 Vout - 28.00
A46: 2011-08-24
A47: sensor P07
A48: Vs | B48: 5.112
A49: Vo | B49: 2.573
A50: coef | B50: 10.87 | C50: -27.96
A51: P = 10.87 Vout - 27.96
A53: 2011-08-24
A54: sensor P08
A55: Vs | B55: 5.106
A56: Vo | B56: 2.575
A57: coef | B57: 10.88 | C57: -28.02
A58: P = 10.88 Vout - 28.02
A60: 2011-08-24
A61: sensor P09
A62: Vs | B62: 5.123
A63: Vo | B63: 2.586
A64: coef | B64: 10.84 | C64: -28.04
A65: P = 10.84 Vout - 28.04
A67: 2011-08-24
A68: sensor P10
A69: Vs | B69: 5.134
A70: Vo | B70: 2.586
A71: coef | B71: 10.82 | C71: -27.98
A72: P = 10.82 Vout - 27.98

B1: 2011-08-05
B2: sensor P01
B3: Vs | C3: 5.1269999999999998
B4: Vo | C4: 2.5859999999999999
B5: coef | C5: =1/C3/0.018 -> 10.835879765078129 | D5: =-C4*C5 -> -28.021585072492041
B6: P = 10.84 Vout - 28.02
B8: 2011-08-05
B9: sensor P02
B10: Vs | C10: 5.1150000000000002
B11: Vo | C11: 2.58
B12: coef | C12: =1/C11/0.018 -> 10.86130118388183 | D12: =-C12*C13 -> -28.022157054415121
B13: P = 10.86 Vout - 28.02
B15: 2011-08-05
B16: sensor P03
B17: Vs | C17: 5.109
B18: Vo | C18: 2.5619999999999998
B19: coef | C19: =1/C19/0.018 -> 10.874056675583393 | D19: =-C20*C21 -> -27.859333202844653
B20: P = 10.87Vout - 27.86
B22: 2011-08-05
B23: sensor P04
B24: Vs | C24: 5.1109999999999998
B25: Vo | C25: 2.5739999999999998
B26: coef | C26: =1/C27/0.018 -> 10.869801517424293 | D26: =-C28*C29 -> -27.978869105850126
B27: P = 10.87 Vout - 27.98